{
  "experiment_id": "WF_EX_011_smartlink_4_1_1_observability",
  "procedure_id": "WF_EX_011_apply_codex_v1",
  "agent_id": "operator_codex",
  "profile_id": "codex_vscode_main",
  "run_index": 1,
  "metrics_snapshot": [],
  "ext": {
    "phase": "apply_plan",
    "status": "completed",
    "inputs": {
      "config_ref": "lab/examples/ds.lab_workflow_experiment_config_v1.WF_EX_011_smartlink_4_1_1_observability.json",
      "plan_result_ref": "lab/examples/env.lab_workflow_experiment_plan_result_v1.WF_EX_011_smartlink_4_1_1_observability.json",
      "baseline_refs": [
        "lab/experiments/smartlink_4_1_1_candidate_ex010/schemas/ds.smartlink_redirect_event_v1.schema.json",
        "lab/experiments/smartlink_4_1_1_candidate_ex010/envelopes/env.smartlink_redirect_event_v1.json",
        "lab/experiments/smartlink_4_1_1_candidate_ex010/schemas/global.smartlink_v1.json",
        "lab/experiments/smartlink_4_1_1_candidate_ex010/schemas/meta.smartlink_v1.json"
      ],
      "candidate_refs": [
        "lab/experiments/smartlink_4_1_1_candidate_ex011_codex/schemas/ds.smartlink_redirect_event_v1.schema.json",
        "lab/experiments/smartlink_4_1_1_candidate_ex011_codex/envelopes/env.smartlink_redirect_event_v1.json",
        "lab/experiments/smartlink_4_1_1_candidate_ex011_codex/schemas/global.smartlink_v1.json",
        "lab/experiments/smartlink_4_1_1_candidate_ex011_codex/schemas/meta.smartlink_v1.json"
      ]
    },
    "changes_summary": {
      "ds.smartlink.redirect_event.v1": [
        "Codex: core split into link/decision/routing/context; marketing folded into traffic; debug optional."
      ],
      "env.smartlink.redirect_event.v1": [
        "Codex: inputs context + decision + debug_mode, optional debug block."
      ],
      "global.smartlink.v1": [
        "Codex: minimal global model for events/text_channels, only smartlink.redirected."
      ],
      "meta.smartlink.v1": [
        "Codex: observability package with references to its ds/env/global, scope limited to redirect event."
      ]
    },
    "notes_from_operator": "Codex observability variant applied separately from the ChatGPT baseline; core SmartLink from WF_EX_010 was not changed."
  }
}
