{
  "experiment_id": "WF_EX_001_repo_change_plan_vs_agents_v1",
  "procedure_id": "WF_EX_001_candidate_codex_only_repo_change_plan_v1",
  "agent_id": "codex_only",
  "profile_id": "codex_vscode_main",
  "run_index": 1,
  "metrics_snapshot": [
    {
      "metric_id": "time_to_solution",
      "value": 35,
      "unit": "minutes"
    },
    {
      "metric_id": "files_touched",
      "value": 18,
      "unit": "files"
    },
    {
      "metric_id": "subjective_quality",
      "value": 4,
      "unit": "score_1_5"
    }
  ]
}
